{
  "caps_version": "1.0.0-rc1",
  "manifest_version": 3,
  "supported_caps_range": ">=1.0.0-rc1 <2.0.0",
  "signed_at": "2026-05-06T08:02:12.365Z",
  "signer_pubkey": "79ytmaoU3IeDHKzqoySQLL1Sjo1orGHOY/wnou8sdbw=",
  "programs": [
    {
      "id": "amazon-associates",
      "name": "Amazon Associates",
      "programType": "direct-injection",
      "domains": [
        "amazon.com",
        "amazon.es",
        "amazon.de",
        "amazon.fr",
        "amazon.it",
        "amazon.co.uk"
      ],
      "param": "tag",
      "valueShape": "non-empty",
      "notes": "Seeded from yocreoquesi/muga@582b60e2:src/lib/affiliates.js (6 marketplace entries amazon_es/de/fr/it/co_uk/com consolidated into one CAPS entry; ourTag is per-implementer and lives outside the manifest). Reference URL upgraded 2026-05-06 from `/help/topic/t10` (volatile navigation hub) to `/help/operating/agreement` (stable authoritative legal text confirming 'tagged' link formats) after the monthly reverification CI flagged similarity drift in #32.",
      "references": [
        {
          "url": "https://affiliate-program.amazon.com/help/operating/agreement",
          "archivedAt": "2026-05-06",
          "archivedUrl": "https://web.archive.org/web/20260506070712/https://affiliate-program.amazon.com/help/operating/agreement"
        }
      ]
    },
    {
      "id": "ebay-partner-network",
      "name": "eBay Partner Network",
      "programType": "direct-injection",
      "domains": [
        "ebay.com",
        "ebay.es",
        "ebay.de",
        "ebay.co.uk",
        "ebay.fr",
        "ebay.it"
      ],
      "param": "campid",
      "valueShape": "non-empty",
      "notes": "Seeded from yocreoquesi/muga@582b60e2:src/lib/affiliates.js (single eBay entry covering 6 marketplace hosts).",
      "references": [
        {
          "url": "https://partnernetwork.ebay.com/",
          "archivedAt": "2026-05-04",
          "archivedUrl": "https://web.archive.org/web/20260504000000/https://partnernetwork.ebay.com/"
        }
      ]
    },
    {
      "id": "booking",
      "name": "Booking.com Affiliate Programme",
      "programType": "deprecated",
      "domains": [
        "booking.com"
      ],
      "param": "aid",
      "valueShape": "non-empty",
      "notes": "Seeded from yocreoquesi/muga@582b60e2:src/lib/affiliates.js. Soft-deprecated 2026-05-05: Booking.com terminated direct affiliate partnerships in May 2025 and migrated affiliates to its third-party network channels (primarily Awin globally; CJ Affiliate in some regions). The new path is covered by the existing `awin` network-redirect entry; a future PR may add `cj-affiliate` for the regional CJ channel.",
      "deprecatedAt": "2026-05-05",
      "deprecationReason": "Upstream change of nature: in May 2025 Booking.com sent mass termination notices to direct affiliate partners (typical wording: \"determined that our current strategic focus unfortunately does not support continuing our partnership\") and required migration to network channels. Affiliate management is now handled via Awin globally, with CJ Affiliate as a secondary regional option. The `?aid=` direct-attribution path on booking.com is no longer the documented onboarding for new partners. Coverage continues under the existing `awin` network-redirect entry. See incident filed via .github/ISSUE_TEMPLATE/incident-disclosure.yml.",
      "references": [
        {
          "url": "https://www.booking.com/affiliate-program/v2/",
          "archivedAt": "2026-05-04",
          "archivedUrl": "https://web.archive.org/web/20260504000000/https://www.booking.com/affiliate-program/v2/"
        }
      ]
    },
    {
      "id": "vercel",
      "name": "Vercel Referrals",
      "programType": "direct-injection",
      "domains": [
        "vercel.com"
      ],
      "param": "ref",
      "valueShape": "non-empty",
      "notes": "Seeded from yocreoquesi/muga@582b60e2:src/lib/affiliates.js.",
      "references": [
        {
          "url": "https://vercel.com/help/referral-program",
          "archivedAt": "2026-05-04",
          "archivedUrl": "https://web.archive.org/web/20260504000000/https://vercel.com/help/referral-program"
        }
      ]
    },
    {
      "id": "digitalocean",
      "name": "DigitalOcean Referrals",
      "programType": "direct-injection",
      "domains": [
        "digitalocean.com",
        "cloud.digitalocean.com",
        "try.digitalocean.com",
        "m.do.co"
      ],
      "param": "refcode",
      "valueShape": "non-empty",
      "notes": "Seeded from yocreoquesi/muga@582b60e2:src/lib/affiliates.js (4 first-party hostnames including the m.do.co short domain).",
      "references": [
        {
          "url": "https://www.digitalocean.com/referral-program",
          "archivedAt": "2026-05-04",
          "archivedUrl": "https://web.archive.org/web/20260504000000/https://www.digitalocean.com/referral-program"
        }
      ]
    },
    {
      "id": "humble-bundle",
      "name": "Humble Bundle Partners",
      "programType": "deprecated",
      "domains": [
        "humblebundle.com"
      ],
      "param": "partner",
      "valueShape": "non-empty",
      "notes": "Seeded from yocreoquesi/muga@582b60e2:src/lib/affiliates.js (id renamed humble_bundle → humble-bundle for kebab-case consistency). Soft-deprecated 2026-05-05: program migrated to Impact (impact.com); attribution now flows via network-redirect through *.pxf.io and is covered by the existing impact-radius entry.",
      "deprecatedAt": "2026-05-05",
      "deprecationReason": "Upstream change of nature: Humble Bundle migrated affiliate onboarding and attribution to Impact (impact.com). The current Affiliate Program Terms describe link issuance and payout exclusively through the Impact platform, with no reference to a `partner` URL parameter on humblebundle.com. Coverage continues under the existing `impact-radius` network-redirect entry (*.pxf.io). See incident #35.",
      "references": [
        {
          "url": "https://www.humblebundle.com/partners",
          "archivedAt": "2026-05-04",
          "archivedUrl": "https://web.archive.org/web/20260504000000/https://www.humblebundle.com/partners"
        }
      ]
    },
    {
      "id": "lemon-squeezy",
      "name": "Lemon Squeezy Affiliates",
      "programType": "direct-injection",
      "domains": [
        "lemonsqueezy.com"
      ],
      "param": "aff",
      "valueShape": "non-empty",
      "notes": "Seeded from yocreoquesi/muga@582b60e2:src/lib/affiliates.js. Sellers live on per-seller subdomains <seller>.lemonsqueezy.com; canonical-host matching covers the apex only — adopters that need subdomain matching should track upstream issue.",
      "references": [
        {
          "url": "https://www.lemonsqueezy.com/",
          "archivedAt": "2026-05-04",
          "archivedUrl": "https://web.archive.org/web/20260504000000/https://www.lemonsqueezy.com/"
        }
      ]
    },
    {
      "id": "apple-phg",
      "name": "Apple Services Performance Partners",
      "programType": "direct-injection",
      "domains": [
        "music.apple.com",
        "geo.music.apple.com",
        "tv.apple.com",
        "books.apple.com",
        "podcasts.apple.com",
        "apps.apple.com",
        "itunes.apple.com"
      ],
      "param": "at",
      "valueShape": "non-empty",
      "notes": "Apple's affiliate program — historically the iTunes Affiliate Program, rebranded to Performance Partners with the back-end migrated to Partnerize. The affiliate token travels in `?at=` (max 40 chars per Apple's linking guide). The `?ct=` parameter exists but is the optional campaign-name field, NOT the attribution token, and adopters MUST NOT match on it. Multiple Apple service hostnames carry the same `at` mechanism — listed individually under the exact-host matching rule (SPEC §3.2 step 5). The corporate apex apple.com is intentionally excluded — it does not host commerce surfaces and a partner token there has no effect. The geo.music.apple.com host is the country-redirector front for Apple Music links and is included because publisher tooling (Apple's own Marketing Toolbox) issues `at`-tagged URLs against it.",
      "references": [
        {
          "url": "https://performance-partners.apple.com/linking",
          "archivedAt": "2026-05-06",
          "archivedUrl": "https://web.archive.org/web/20260506000000/https://performance-partners.apple.com/linking"
        }
      ]
    },
    {
      "id": "anonym-to",
      "name": "anonym.to (privacy proxy)",
      "programType": "network-redirect",
      "domains": [
        "anonym.to"
      ],
      "param": "url",
      "valueShape": "non-empty",
      "notes": "Seeded from yocreoquesi/caps-spec:wrappers.json#anonymto. Naked-query privacy proxy: destination travels directly after `?` with no parameter key. The `param` field is informational only for network-redirect (SPEC §5.1).",
      "references": [
        {
          "url": "https://anonym.to/"
        }
      ]
    },
    {
      "id": "awin",
      "name": "Awin",
      "programType": "network-redirect",
      "domains": [
        "awin1.com"
      ],
      "param": "p",
      "valueShape": "non-empty",
      "notes": "Seeded from yocreoquesi/caps-spec:wrappers.json#awin. Click endpoint `/cread.php` carries the destination merchant URL in `p`.",
      "references": [
        {
          "url": "https://www.awin.com/"
        }
      ]
    },
    {
      "id": "cj-affiliate",
      "name": "CJ Affiliate (Commission Junction)",
      "programType": "network-redirect",
      "domains": [
        "anrdoezrs.net",
        "dpbolvw.net",
        "jdoqocy.com",
        "kqzyfj.com",
        "tkqlhce.com",
        "emjcd.com",
        "qksrv.net",
        "cj.dotomi.com"
      ],
      "param": "url",
      "valueShape": "non-empty",